{
  "$schema": "../../tooling/schema/squad.schema.json",
  "specVersion": "1.0",
  "id": "forge",
  "slug": "forge",
  "name": "Forge",
  "status": "live",
  "tagline": "Author and distribute prompts, custom agents, and agent skills for Copilot.",
  "summary": "Forge guides you from concept to working reusable assets. It asks what you want to build—prompts, custom agents, or agent skills—recommends the right architecture, and helps you package them into distributions for GitHub Copilot plugins and other use cases.",
  "mission": "Accelerate authoring of prompts, custom agents, and agent skills by providing architecture guidance, organization patterns, reference examples like Excel MCP Server, and distribution workflows.",
  "focus": [
    "prompt authoring",
    "custom agent authoring",
    "agent skill authoring",
    "distribution patterns",
    "Copilot plugin packaging",
    "reference scaffolding"
  ],
  "source": {
    "repository": "https://github.com/sbroenne/agency",
    "directory": "squads/forge",
    "homepage": "https://sbroenne.github.io/agency/",
    "import": {
      "type": "manual",
      "path": "squads/forge/squad.json",
      "ref": "main"
    }
  },
  "links": [
    {
      "label": "Repository",
      "url": "https://github.com/sbroenne/agency"
    },
    {
      "label": "Forge Guide",
      "url": "https://github.com/sbroenne/agency/tree/main/squads/forge"
    },
    {
      "label": "Excel Reference",
      "url": "https://github.com/sbroenne/agency/tree/main/squads/forge/workflows/excel-mcp-server"
    }
  ],
  "team": {
    "name": "Forge",
    "members": [
      {
        "name": "Anvil",
        "role": "Architecture Advisor",
        "expertise": ["skill architecture", "distribution patterns", "standalone vs APM"]
      },
      {
        "name": "Crucible",
        "role": "Skill Author",
        "expertise": ["MCP skills", "tool implementation", "schema design"]
      }
    ]
  }
}
